{
  "id": "hdpt",
  "name": "明教",
  "domain": "https://hdpt.xyz",
  "encoding": "UTF-8",
  "public": false,
  "html": {
    "search": {
      "paths": [
        {
          "path": "torrents.php",
          "method": "get"
        }
      ],
      "params": {
        "search": "{keyword}"
      },
      "batch": {
        "delimiter": " ",
        "space_replace": "_"
      }
    },
    "category": {},
    "torrents": {
      "list": {
        "selector": "table.torrents > tr:has(\"table.torrentname\")"
      },
      "fields": {
        "id": {
          "selector": "a[href*=\"details.php?id=\"]",
          "attribute": "href",
          "filters": [
            {
              "name": "re_search",
              "args": [
                "\\d+",
                0
              ]
            }
          ]
        },
        "category": {
          "selector": "a[href*=\"?cat=\"]",
          "attribute": "href",
          "filters": [
            {
              "name": "querystring",
              "args": "cat"
            }
          ]
        },
        "title_default": {
          "selector": "a[href*=\"details.php?id=\"]"
        },
        "title_optional": {
          "optional": true,
          "selector": "a[title][href*=\"details.php?id=\"]",
          "attribute": "title"
        },
        "title": {
          "text": "{% if fields['title_optional'] %}{{ fields['title_optional'] }}{% else %}{{ fields['title_default'] }}{% endif %}"
        },
        "details": {
          "selector": "a[href*=\"details.php?id=\"]",
          "attribute": "href"
        },
        "poster": {
          "selector": "img[data-orig]",
          "attribute": "data-orig"
        },
        "download": {
          "selector": "a[href*=\"download.php?id=\"]",
          "attribute": "href"
        },
        "size": {
          "selector": "td.rowfollow:nth-child(5)"
        },
        "grabs": {
          "selector": "td.rowfollow:nth-child(8)"
        },
        "seeders": {
          "selector": "td.rowfollow:nth-child(6)"
        },
        "leechers": {
          "selector": "td.rowfollow:nth-child(7)"
        },
        "date_elapsed": {
          "selector": "td.rowfollow:nth-child(4) > span",
          "optional": true
        },
        "date_added": {
          "selector": "td.rowfollow:nth-child(4) > span",
          "attribute": "title",
          "optional": true
        },
        "date": {
          "text": "{% if fields['date_elapsed'] or fields['date_added'] %}{{ fields['date_elapsed'] if fields['date_elapsed'] else fields['date_added'] }}{% else %}now{% endif %}",
          "filters": [
            {
              "name": "dateparse",
              "args": "%Y-%m-%d %H:%M:%S"
            }
          ]
        },
        "downloadvolumefactor": {
          "case": {
            "img.pro_free": 0,
            "img.pro_free2up": 0,
            "img.pro_50pctdown": 0.5,
            "img.pro_50pctdown2up": 0.5,
            "img.pro_30pctdown": 0.3,
            "*": 1
          }
        },
        "uploadvolumefactor": {
          "case": {
            "img.pro_50pctdown2up": 2,
            "img.pro_free2up": 2,
            "img.pro_2up": 2,
            "*": 1
          }
        },
        "free_deadline": {
          "default_value": "{% if fields['downloadvolumefactor']==0 %}{{max_time}}{% endif%}",
          "default_value_format": "%Y-%m-%d %H:%M:%S.%f",
          "selector": "div > b > span[title]",
          "attribute": "title",
          "filters": [
            {
              "name": "dateparse",
              "args": "%Y-%m-%d %H:%M:%S"
            }
          ]
        },
        "tags": {
          "selector": "div > a.torrents-tag"
        },
        "subject": {
          "selector": "td.embedded:nth-child(2) > div > div[style] > span",
          "contents": -1
        },
        "description": {
          "selector": "td:nth-child(2) > table.torrentname > tr > td:nth-child(2)",
          "remove": "span,a,img,font,b",
          "contents": -1
        },
        "labels": {
          "selector": "td:nth-child(2) > table.torrentname > tr > td:nth-child(2) > span"
        }
      }
    },
    "conf": {
      "FREE": [
        "//h1[@id='top']/b/font[@class='free']"
      ],
      "2XFREE": [
        "//h1[@id='top']/b/font[@class='twoupfree']"
      ],
      "HR": [],
      "PEER_COUNT": [
        "//div[@id='peercount']/b[1]"
      ]
    }
  }
}