{
  "id": "opencd",
  "name": "皇后",
  "domain": "https://open.cd",
  "encoding": "UTF-8",
  "public": false,
  "html": {
    "search": {
      "paths": [
        {
          "path": "torrents.php",
          "method": "get"
        }
      ],
      "params": {
        "search": "{keyword}"
      },
      "batch": {
        "delimiter": " ",
        "space_replace": "_"
      }
    },
    "category": {},
    "torrents": {
      "list": {
        "selector": "table.torrents > tr:has(\"table.torrentname\")"
      },
      "fields": {
        "id": {
          "selector": "a[href*=\"details.php?id=\"]",
          "attribute": "href",
          "filters": [
            {
              "name": "re_search",
              "args": [
                "\\d+",
                0
              ]
            }
          ]
        },
        "category": {
          "selector": "a[href*=\"?cat=\"]",
          "attribute": "href",
          "filters": [
            {
              "name": "querystring",
              "args": "cat"
            }
          ]
        },
        "title_default": {
          "selector": "a[href*=\"details.php?id=\"]"
        },
        "title_optional": {
          "optional": true,
          "selector": "a[title][href*=\"details.php?id=\"]",
          "attribute": "title"
        },
        "title": {
          "text": "{% if fields['title_optional'] %}{{ fields['title_optional'] }}{% else %}{{ fields['title_default'] }}{% endif %}"
        },
        "details": {
          "selector": "a[href*=\"details.php?id=\"]",
          "attribute": "href"
        },
        "download": {
          "selector": "a[href*=\"download.php?id=\"]",
          "attribute": "href"
        },
        "size": {
          "selector": "td:nth-child(7)"
        },
        "grabs": {
          "selector": "td:nth-child(10)"
        },
        "seeders": {
          "selector": "td:nth-child(8)"
        },
        "leechers": {
          "selector": "td:nth-child(9)"
        },
        "date_elapsed": {
          "selector": "td:nth-child(6) > span",
          "optional": true
        },
        "date_added": {
          "selector": "td:nth-child(6) > span",
          "attribute": "title",
          "optional": true
        },
        "date": {
          "text": "{% if fields['date_elapsed'] or fields['date_added'] %}{{ fields['date_elapsed'] if fields['date_elapsed'] else fields['date_added'] }}{% else %}now{% endif %}",
          "filters": [
            {
              "name": "dateparse",
              "args": "%Y-%m-%d %H:%M:%S"
            }
          ]
        },
        "downloadvolumefactor": {
          "case": {
            "img.pro_free": 0,
            "img.pro_free2up": 0,
            "img.pro_50pctdown": 0.5,
            "img.pro_50pctdown2up": 0.5,
            "img.pro_30pctdown": 0.3,
            "*": 1
          }
        },
        "uploadvolumefactor": {
          "case": {
            "img.pro_50pctdown2up": 2,
            "img.pro_free2up": 2,
            "img.pro_2up": 2,
            "*": 1
          }
        },
        "free_deadline": {
          "default_value": "{% if fields['downloadvolumefactor']==0 %}{{max_time}}{% endif%}",
          "default_value_format": "%Y-%m-%d %H:%M:%S.%f",
          "selector": "td[class=\"embedded\"] > b > span[title]",
          "attribute": "title",
          "filters": [
            {
              "name": "dateparse",
              "args": "%Y-%m-%d %H:%M:%S"
            }
          ]
        },
        "description": {
          "selector": "table.torrentname > tr > td.embedded > font",
          "index": -1
        },
        "labels": {
          "selector": "table.torrentname > tr > td.embedded > i > a"
        }
      }
    },
    "conf": {
      "FREE": [
        "//div[@class='title']/img[@class='pro_free']"
      ],
      "2XFREE": [
        "//div[@class='title']/img[@class='pro_free2up']"
      ],
      "HR": [],
      "PEER_COUNT": []
    }
  }
}