{
  "id": "hares",
  "name": "白兔",
  "domain": "https://club.hares.top",
  "encoding": "UTF-8",
  "public": false,
  "html": {
    "search": {
      "paths": [
        {
          "path": "torrents.php",
          "method": "get"
        }
      ],
      "params": {
        "search": "{keyword}"
      },
      "batch": {
        "delimiter": " ",
        "space_replace": "_"
      }
    },
    "category": {},
    "torrents": {
      "list": {
        "selector": "table.torrents > tr"
      },
      "fields": {
        "id": {
          "selector": "a[href*=\"details.php?id=\"]",
          "attribute": "href",
          "filters": [
            {
              "name": "re_search",
              "args": [
                "\\d+",
                0
              ]
            }
          ]
        },
        "title_default": {
          "selector": "a[href*=\"details.php?id=\"]"
        },
        "title_optional": {
          "optional": true,
          "selector": "a[title][href*=\"details.php?id=\"]",
          "attribute": "title"
        },
        "title": {
          "text": "{% if fields['title_optional'] %}{{ fields['title_optional'] }}{% else %}{{ fields['title_default'] }}{% endif %}"
        },
        "category": {
          "selector": "a[href*=\"?cat=\"]",
          "attribute": "href",
          "filters": [
            {
              "name": "replace",
              "args": [
                "?",
                ""
              ]
            },
            {
              "name": "querystring",
              "args": "cat"
            }
          ]
        },
        "details": {
          "selector": "a[href*=\"details.php?id=\"]",
          "attribute": "href"
        },
        "download": {
          "selector": "a[href*=\"download.php?id=\"]",
          "attribute": "href"
        },
        "date_elapsed": {
          "selector": "td:nth-child(4) > span",
          "optional": true
        },
        "date_added": {
          "selector": "td:nth-child(4) > span",
          "attribute": "title",
          "optional": true
        },
        "date": {
          "text": "{% if fields['date_elapsed'] or fields['date_added'] %}{{ fields['date_elapsed'] if fields['date_elapsed'] else fields['date_added'] }}{% else %}now{% endif %}",
          "filters": [
            {
              "name": "dateparse",
              "args": "%Y-%m-%d %H:%M:%S"
            }
          ]
        },
        "size": {
          "selector": "td:nth-child(5)"
        },
        "seeders": {
          "selector": "td:nth-child(6)"
        },
        "leechers": {
          "selector": "td:nth-child(7)"
        },
        "grabs": {
          "selector": "td:nth-child(8)"
        },
        "downloadvolumefactor": {
          "case": {
            "img.pro_free": 0,
            "img.pro_free2up": 0,
            "img.pro_50pctdown": 0.5,
            "img.pro_50pctdown2up": 0.5,
            "img.pro_30pctdown": 0.3,
            "*": 1
          }
        },
        "uploadvolumefactor": {
          "case": {
            "img.pro_50pctdown2up": 2,
            "img.pro_free2up": 2,
            "img.pro_2up": 2,
            "*": 1
          }
        },
        "free_deadline": {
          "default_value": "{% if fields['downloadvolumefactor']==0 %}{{max_time}}{% endif%}",
          "default_value_format": "%Y-%m-%d %H:%M:%S.%f",
          "selector": "img.pro_free,img.pro_free2up,img.pro_50pctdown,img.pro_50pctdown2up,img.pro_30pctdown",
          "attribute": "data-d",
          "filters": [
            {
              "name": "re_search",
              "args": [
                "\\d{4}-\\d{2}-\\d{2} \\d{2}:\\d{2}:\\d{2}",
                0
              ]
            },
            {
              "name": "dateparse",
              "args": "%Y-%m-%d %H:%M:%S"
            }
          ]
        },
        "description": {
          "selector": "div.layui-torrents-Subject > div.left > p.layui-elip.layui-torrents-descr-width"
        },
        "labels": {
          "selector": "div.layui-torrents-Subject > div.left > p.layui-elip.layui-torrents-descr-width > span"
        }
      }
    },
    "conf": {
      "FREE": [
        "//b[@class='free'][text()='免费']"
      ],
      "2XFREE": [
        "//b[@class='twoupfree'][text()='2X免费']"
      ],
      "HR": [],
      "PEER_COUNT": []
    }
  }
}